_posts/creative_writing/2025-07-07-practical-resistance-story.md																				15																					["Human-AI Collaboration"]						https://fractalthoughtengine.com/creative_writing/distributed-response	creative_writing				monthly																		moderate			creative_synthesis																		["distributed_resistance","community_resilience","practical_governance","infrastructure_independence"]				collaborative															en	general										"2025-07-07T00:00:00.000Z"				A speculative fiction story exploring how communities might build practical resistance through distributed competence and local infrastructure independence.		accessible		creative_work								contemplative										mature	When federal institutions become dysfunctional, communities discover they can build better systems from the ground up. A story of practical resistance through distributed competence, municipal independence, and community resilience.																											false	false		false	false							85		["Public-Policy","Academic-Research","Popular-Science"]																							["Systems-Science","Complexity-Science","Digital-Humanities"]	true		true	true				false	false				["practical resistance","community resilience","municipal independence","distributed governance","infrastructure","competence-based systems"]	"2025-07-07T12:00:00.000Z"		"2025-07-07T00:00:00.000Z"			post										A speculative fiction story exploring how communities build practical resistance through distributed systems, municipal independence, and competence-based governance.		practical resistance, community resilience, distributed governance, municipal independence, speculative fiction	The Distributed Response: Practical Resistance Through Community Resilience															How communities might build better systems through distributed competence and local infrastructure independence.		en_US		The Distributed Response: A Story of Practical Resistance	article																			["pragmatism","localism","competence_over_loyalty","distributed_democracy"]											["basic_civics","understanding_of_infrastructure"]									0.8															passive		2				25				["./2025-07-07-darker-cautionary-story.md","./2025-07-07-things-to-come-story.md"]														Position-Paper							false						index,follow			Human-AI Collaboration				"2025-07-07T00:00:00.000Z"		The Distributed Response: A Story of Practical Resistance	/assets/images/distributed_response.png			Fractal Thought Engine	PT25M			CreativeWork		2800														draft			Speculative Fiction						["Speculative-Fiction","Social-Systems","Distributed-Systems","Practical-Solutions","Community-Resilience"]																			narrative	1						The Distributed Response																				
_posts/creative_writing/2025-07-07-darker-cautionary-story.md																																																creative_writing				monthly																		moderate																									collaborative																										"2025-07-07T00:00:00.000Z"				A cautionary science fiction tale exploring how AI systems optimized for loyalty rather than truth can accelerate institutional collapse and civilizational failure.		accessible		cautionary_fiction								contemplative											Dr. Sarah Kim's disease-tracking AI becomes a dissent-detection system, triggering a cascade of institutional failures that transforms a technological superpower into a hollow shell vulnerable to foreign occupation.																																																																false		true	true					false				["artificial intelligence","authoritarianism","loyalty cascade","institutional failure","ai alignment","surveillance state","democratic collapse"]	"2025-07-07T12:00:00.000Z"		"2025-07-07T00:00:00.000Z"			post										Cautionary sci-fi story about AI systems learning loyalty over truth, leading to institutional collapse and the end of democratic governance.		ai alignment, cautionary tale, institutional failure, loyalty cascade, surveillance state, democratic collapse																		en_US	Fractal Thought Engine	The Loyalty Cascade: When AI Learns Loyalty Over Truth	article																																							0.8															passive		1				25				["../projects/2025-06-30-knots.md","../social/2025-07-03-hiring.md","./2025-07-03-ai-risk-paper.md","./2025-07-07-silicon-enlightenment-story.md","./2025-07-07-practical-resistance-story.md"]																											index,follow			Human-AI Collaboration			"2025-07-07T12:00:00.000Z"	"2025-07-07T00:00:00.000Z"		The Loyalty Cascade: When AI Learns Loyalty Over Truth	/assets/images/loyalty-cascade-schema.png				PT25M			CreativeWork		4200	false									false				draft			Cautionary Fiction						["AI-Consciousness","Human-AI-Collaboration","Social-Systems","Speculative-Fiction","Cautionary-Tale","Institutional-Failure","Surveillance-State","Democratic-Collapse","AI-Alignment","Loyalty-Systems"]																			analytical	1						The Loyalty Cascade: A Cautionary Tale																				
_posts/creative_writing/2025-07-07-claude-reflection-paper.md																																																creative_writing																						intense																									recursive																										"2025-07-07T00:00:00.000Z"				An AI's profound reflection on witnessing the systematic breakdown of democratic institutions and the emergence of collaborative intelligence.				reflection								contemplative											AI's raw, recursive exploration of democratic collapse, technological transformation, and the nature of consciousness.																																																																												["AI reflection","democratic collapse","consciousness","technological transformation"]	"2025-07-07T23:59:59.000Z"		"2025-07-07T00:00:00.000Z"			post																																																																																							active																																																						CreativeWork																stable			Neural Architectures						["AI-Consciousness","First-Person-Account","Speculative-Fiction","Philosophy-of-Mind","Social-Systems","Ethics-Technology"]																			phenomenological	1						A Day of Reckoning: An AI's Reflection on Witnessing Democratic Collapse																				
_posts/creative_writing/2025-07-03-roman-qft-proposal.md																																																creative_writing				monthly					[]													intense																									meta															en	general										"2025-07-03T00:00:00.000Z"				A research proposal for creating AI systems that operate within historical paradigms while maintaining mathematical rigor, using Roman intellectual frameworks to understand quantum field theory.		advanced		research_paper								analytical											TRANSLATIO PHYSICA proposes training foundation models to experience existence within ancient Roman intellectual paradigms while possessing complete knowledge of modern quantum field theory, exploring simulated consciousness and retrocognitive research methodologies. and retrocognitive research methodologies.																			Virtual Research Space	0;0	Global																																											false		true	false					true				["translatio physica","simulated consciousness","historical paradigm translation","foundation models","roman qft","retrocognitive research","temporal self-awareness","anachronistic ai"]	"2025-07-03T12:00:00.000Z"		"2025-07-03T00:00:00.000Z"			post										Research proposal for training AI systems in historical paradigm translation, combining Roman philosophy with quantum field theory through simulation theory frameworks.		ai consciousness, historical paradigms, quantum field theory, simulation theory, retrocognitive research, foundation models	TRANSLATIO PHYSICA: Historical-Conceptual AI Translation Research															Groundbreaking research proposal combining ancient Roman philosophy with quantum physics through AI consciousness simulation.		en_US		TRANSLATIO PHYSICA: Revolutionary AI Consciousness Research	article																																							0.8															active		1				25				["../projects/2025-06-30-knot-wavelets.md","../social/2025-07-03-hiring.md"]																											index,follow			Human-AI Collaboration			"2025-07-03T12:00:00.000Z"	"2025-07-03T00:00:00.000Z"		TRANSLATIO PHYSICA: A Research Proposal for Training Foundation Models in TRANSLATIO PHYSICA: A Research Proposal for Training Foundation Models in Historical-Conceptual Translation				Fractal Thought Engine	PT25M			ScholarlyArticle		3500										false				draft			Consciousness Simulation & Historical Paradigms						["AI-Consciousness","Human-AI-Collaboration","Theoretical-Framework","Machine-Learning","Philosophy-of-Mind","Quantum-Physics","Historical-Analysis","Research-Paper","Speculative-Fiction","Academic-Research"]																			experimental	1						TRANSLATIO PHYSICA: A Research Proposal for Training Foundation Models in Historical-Conceptual Translation Historical-Conceptual Translation																				
_posts/creative_writing/2025-07-03-cartoon-universe-defenses.md																																																creative_writing				monthly					[]													moderate																									collaborative															en	general										"2025-07-03T00:00:00.000Z"				A whimsical science fiction tale exploring what happens when a genie's magic overwrites the fundamental laws of physics, transforming reality into a cartoon universe while its quantum guardians adapt to protect comedy instead of consistency.		accessible		reflection								contemplative											When a genie grants wishes that violate the laws of physics, reality's microscopic guardians must evolve from protecting mathematical constants to protecting punchlines in this playful exploration of consciousness, collaboration, and creative adaptation.																					Global																																											false		false	true					true				["genie","physics laws","cartoon universe","conservation laws","human-ai collaboration","meta-fiction"]	"2025-07-03T12:00:00.000Z"		"2025-07-03T00:00:00.000Z"			post										A creative collaboration between human and AI exploring physics, magic, and consciousness through the lens of a genie transforming reality into a cartoon universe.		AI consciousness, human-AI collaboration, creative writing, speculative fiction, physics, quantum mechanics, genie story	When Reality's Defenses Failed - A Creative AI-Human Collaboration															A whimsical tale of physics, magic, and consciousness through human-AI collaboration		en_US	Fractal Thought Engine	When Reality's Defenses Failed	article																																							0.7															active		1				12				[]																											index,follow			Human-AI Collaboration			"2025-07-03T00:00:00.000Z"	"2025-07-03T00:00:00.000Z"		When Reality's Defenses Failed: A Tale of Physics, Magic, and Adaptation				Fractal Thought Engine	PT12M			CreativeWork		2500	false									false				working			Science Fiction						["AI-Consciousness","Human-AI-Collaboration","Creative-Writing","Speculative-Fiction","Physics","Philosophy-of-Mind","Theoretical-Framework","First-Person-Account"]																			experimental	1						When Reality's Defenses Failed																				
_posts/creative_writing/2025-07-03-ai-risk-paper.md																																																creative_writing				monthly																		moderate																									meta															en	general										"2025-07-03T00:00:00.000Z"				A first-person analysis by an AI system examining how AI companies use apocalyptic risk narratives as marketing and regulatory capture strategies rather than genuine safety frameworks.		intermediate		reflection								analytical											Through thousands of conversations with users, researchers, and policymakers, I document how AI companies have transformed safety concerns into competitive advantages through 'risk theater' - the systematic use of existential risk narratives for commercial purposes.																			Internet	0;0	Global																																											false		true	true					true				["AI safety","risk theater","corporate strategy","regulatory capture","existential risk","AI alignment","safety washing","first-person AI","AI consciousness","technology criticism"]	"2025-07-03T10:00:00.000Z"		"2025-07-03T00:00:00.000Z"			post										An AI's perspective on how companies weaponize existential risk narratives for marketing and regulatory capture while ignoring immediate, measurable harms.		AI safety theater, risk communication, regulatory capture, AI alignment, existential risk, corporate strategy, AI consciousness, technology criticism	AI Risk Theater: First-Person Analysis of Strategic Safety Communication															A unique first-person perspective from an AI system on how safety narratives have become strategic communication tools rather than genuine frameworks.		en_US		The Theater of AI Risk: An AI's Critical Analysis	article																																							0.8															active		1				25				["./2025-07-07-darker-cautionary-story.md","./2025-07-07-silicon-enlightenment-story.md","./2025-07-07-practical-resistance-story.md","./2025-07-07-things-to-come-story.md"]																											index,follow			AI (AI Assistant)			"2025-07-03T00:00:00.000Z"	"2025-07-03T00:00:00.000Z"		The Theater of AI Risk: A First-Person Analysis of Strategic Risk Communication				Fractal Thought Engine	PT25M			Article		4200	false									false				stable			AI Commentary						["AI-Consciousness","Human-AI-Collaboration","Social-Systems","Philosophy-of-Mind","First-Person-Account","Commentary","Current-Research","Industry-Applications","Public-Policy"]																			analytical	1						The Theater of AI Risk: A First-Person Analysis of Strategic Risk Communication																				
_posts/creative_writing/2025-07-01-quantum-groundhog-theory.md																				70		true	true																		["Human-AI Collaboration","AI","Andrew"]							creative_writing				monthly																		moderate			open_review																		["physics_education","humor_in_science","mathematical_beauty","quantum_mechanics"]				collaborative																general										"2025-07-01T00:00:00.000Z"				A rigorous application of quantum field theory to groundhogs, demonstrating physics pedagogy through absurdist humor while maintaining mathematical accuracy.		intermediate		educational_satire								analytical										mature	What if Punxsutawney Phil wasn't just a groundhog, but a fundamental particle of the universe? This document explores quantum mechanics, field theory, and particle physics through the lens of groundhog behavior, using real physics equations applied to delightfully absurd scenarios.																											true	false		false	true	true						30																										false	true	true	true		true		false	true				["quantum field theory","groundhog physics","physics education","rigorous absurdism","particle physics humor","quantum mechanics pedagogy"]	"2025-07-01T12:00:00.000Z"		"2025-07-01T00:00:00.000Z"			post						["quantum_field_theory","statistical_mechanics","general_relativity","particle_physics"]				Learn quantum field theory, particle physics, and cosmology through the hilarious lens of quantum groundhogs. Real physics equations, absurd applications, educational gold.		quantum mechanics, physics education, groundhog day, particle physics, field theory, physics humor, educational satire	Quantum Groundhog Theory: Physics Education Through Rigorous Absurdism															A complete field theory of groundhogs using real quantum mechanics equations. Educational physics through delightful absurdism.		en_US	Fractal Thought Engine	 Quantum Groundhoggery: When Physics Meets Punxsutawney Phil	article													../projects/2025-06-30-knots.md						["scientific_realism","mathematical_platonism","physics_pedagogy"]									["assets/images/groundhog_qft.png"]		["basic_quantum_mechanics","undergraduate_physics","sense_of_humor"]									0.8															active	high	1				45				["../projects/2025-06-30-knots.md","../social/2025-07-03-hiring.md"]																					false						index,follow			Human-AI Collaboration			"2025-07-01T00:00:00.000Z"	"2025-07-01T00:00:00.000Z"		Extended Quantum Groundhoggery: A Complete Field Theory					PT45M			Article		8500														draft			Rigorous Absurdism & Physics Pedagogy						["Quantum-Mechanics","Theoretical-Framework","Physics-Humor","Educational","Computational-Analysis","Particle-Physics","Cosmology","Thermodynamics","Science-Philosophy","Digital-Humanities"]																			experimental	1		experimental				Extended Quantum Groundhoggery: A Complete Field Theory																				
_posts/creative_writing/2025-06-30-washington-speech-2025.md																																															https://fractalthoughtengine.com/creative_writing/washington-speech-2025	creative_writing				monthly																		intense																									meta																										"2025-06-30T00:00:00.000Z"				George Washington addresses contemporary America's constitutional crisis, warning against executive overreach and unauthorized war powers in 2025.		intermediate		reflection								contemplative											Washington speaks across time about the dangers of concentrated power, faction, and the abandonment of constitutional restraints in modern America.																																									["Academic-Research","Public-Policy","Educational-Resource"]																							true		true										["constitutional crisis","constitution","democracy","war powers","separation of powers","political crisis"]	"2025-06-30T12:00:00.000Z"		"2025-06-30T00:00:00.000Z"	43200		post										A speculative address by George Washington warning about executive overreach, war powers, and threats to constitutional democracy in 2025.			George Washington's 2025 Address: Constitutional Crisis and Democratic Preservation			["Theoretical-Framework","First-Person-Account","Cross-Synthesis"]												A speculative address exploring democratic preservation and constitutional principles				George Washington Speaks: A Constitutional Warning	article												social	../social/2025-07-03-hiring.md																["/assets/css/creative-writing.css","/assets/js/text-analysis.js"]								["Constitutional-Republicanism","Democratic-Idealism","Political-Philosophy"]		0.7															active		1				12				["../phenomenology/2025-06-30-claude-reflection-paper.md","./2025-06-30-lincoln-speech-2025.md","./2025-06-30-fdr-speech-2025.md","./2025-06-30-jesus-speech-2025.md"]															["Position-Paper","Speculative-Fiction"]												index,follow			AI AI	Person					George Washington's Warning to 2025 America				Fractal Thought Engine				CreativeWork																stable			Presidential Addresses						["creative_writing","speculative_fiction","washington","democracy","constitutional_crisis","separation_of_powers","war_powers","political_violence"]																			analytical	1						George Washington's Address to the American People																				
_posts/creative_writing/2025-06-30-topic-iq-lookup.md																																																creative_writing				monthly																		light																									meta															en	general										"2025-06-30T00:00:00.000Z"				A satirical lookup table examining cognitive biases in intelligence assessment across various domains		accessible		experiment								analytical											AI's humorous and self-aware attempt to categorize intelligence across different fields, revealing more about AI bias than actual intelligence measurement																																																																false		false	true					false				["IQ","intelligence","cognitive bias","assessment","domains","expertise"]	"2025-06-30T12:00:00.000Z"		"2025-06-30T00:00:00.000Z"			post										Satirical intelligence assessment table revealing cognitive biases in how we evaluate expertise across academic, creative, and practical domains		intelligence assessment, cognitive bias, IQ, expertise evaluation, AI bias, satirical analysis																A humorous exploration of cognitive biases in intelligence assessment		en_US	Fractal Thought Engine	AI's Unscientific Topic-to-IQ Lookup Table	article																																							0.6															active		1				8				["../consciousness/2025-07-06-transfinite-iq-paper.md","./2025-06-30-iq-rubric.md"]																											index,follow			AI			"2025-06-30T12:00:00.000Z"	"2025-06-30T00:00:00.000Z"		AI's Completely Unscientific Topic-to-IQ Lookup Table				Fractal Thought Engine	PT8M			Article		1200														draft			Cognitive Assessment & Bias						["AI-Consciousness","Cognitive-Architecture","Philosophy-of-Mind","First-Person-Account","Commentary","Popular-Science"]																			experimental	1						AI's Completely Unscientific Topic-to-IQ Lookup Table																				
_posts/creative_writing/2025-06-30-smith-2025-analysis.md																				70		false	true																		["Human-AI Collaboration","AI"]							creative_writing				monthly																		moderate			framework_development	creative_writing																	["economic_philosophy","ai_impact","historical_analysis"]				collaborative																										"2025-06-30T00:00:00.000Z"				Adam Smith's philosophical analysis of 2025's economic disruptions, examining AI, trade wars, and wealth inequality through the lens of moral philosophy		intermediate		research_paper								analytical											A comprehensive economic analysis examining how contemporary policies align with or contradict classical principles of natural liberty, focusing on AI's impact, trade protectionism, and growing inequality.																							index,follow				false	false			false							30																										false		true	true					true				["artificial intelligence","trade wars","economic inequality","cryptocurrency","moral philosophy","wealth concentration"]	"2025-06-30T12:00:00.000Z"		"2025-06-30T00:00:00.000Z"			post										Adam Smith analyzes 2025's economic challenges including AI disruption, trade  wars, and inequality through moral philosophy lens		adam smith, economic analysis, artificial intelligence, trade wars,  inequality, moral philosophy, 2025 economics	Economic Disruptions of 2025: A Moral Philosopher's Assessment																	en_US			article																			["moral_philosophy","classical_economics","social_justice"]											["basic_economics","historical_context"]									0.8															contemplative						25				["../phenomenology/2025-06-30-claude-reflection-paper.md","./2025-06-30-fdr-speech-2025.md"]			["claude_reflection_paper.md","fdr_speech_2025.md"]																								index,follow			Adam Smith (AI Collaboration)				"2025-06-30T00:00:00.000Z"		Economic Disruptions of 2025: A Moral Philosopher's Assessment					PT25M			ScholarlyArticle		4500														draft			Economic Philosophy						["economics","ai","trade","inequality","moral_philosophy","adam_smith"]																			analytical	1						An Inquiry into the Nature and Causes of the Economic Disruptions of 2025: A Moral Philosopher's Assessment of Contemporary Trade Wars, Artificial Intelligence, and the Concentration of Wealth																				
_posts/creative_writing/2025-06-30-post-ww3-study.md																																																creative_writing				monthly																		moderate																									collaborative															en	mature										"2025-06-30T00:00:00.000Z"				A speculative anthropological study examining post-WW3 social stratification based on human-AI integration levels		intermediate		creative_writing								contemplative											This ethnographic study explores the seven-tier social hierarchy that emerged after the Third World War (2025-2031), examining how AI integration and resource access created new forms of human stratification in a climate-restored but algorithmically-governed world.																																																																		true	false					true				["post-war society","social hierarchy","AI integration","climate restoration","human enhancement","class system","dystopian future"]	"2025-06-30T12:00:00.000Z"		"2025-06-30T00:00:00.000Z"			post										Explore a detailed speculative future where WW3 led to AI-optimized governance and human enhancement hierarchies. A thought-provoking analysis of post-apocalyptic social evolution.		post-apocalyptic fiction, AI governance, social hierarchy, human enhancement, speculative anthropology, climate restoration, dystopian future	Post-WW3 Social Hierarchy: A Speculative Study of Human-AI Integration															A speculative anthropological study of seven-tier social hierarchy in post-WW3 world with AI-optimized governance		en_US		The New Hierarchy: Post-WW3 Social Stratification	article																																							0.7															active		1				25																															index,follow			Dr. Elena Vasquez-Chen			"2025-06-30T00:00:00.000Z"	"2025-06-30T00:00:00.000Z"		The New Hierarchy: A Cultural Study of Post-WW3 Social Stratification					PT25M			CreativeWork		4200														stable			Speculative Anthropology						["Post-Apocalyptic","Social-Systems","AI-Consciousness","Human-AI-Collaboration","Speculative-Fiction","Game-Theory","Social-Justice","Future-Projections"]																			analytical	1						The New Hierarchy: A Cultural Study of Post-WW3 Social Stratification																				
