filepath	+breadcrumb_schema	+content_language	+content_rating	+faq_schema	+geo_region	+how_to_schema	+review_schema	+search_exclude	+sitemap_exclude	academic_discipline	academic_impact_projection	accessibility_features	accessibility_level	accessibility_notes	activation_function	actors	adaptation_context	adapts_to_reader	age_appropriateness	ai_contribution	ai_contribution_percentage	allows_collaboration	allows_comments	alternate_urls	analysis_depth	analysis_sections	application_domain	application_domain_tags	application_domains	application_tags	architecture_layers	archival_doi	arxiv_id	attention_responsive	attribution_required	audience_tags	authenticity_markers	author	author_expertise	author_notes	authors	auto_update	bingbot	breadcrumb_schema	breaking_changes	business_rules	canonical_url	category	central_conflict	central_themes	change_log	changefreq	character_count	character_reference_images	characters	characters_count	child_documents	citation_format	citation_key	code_examples	code_includes_error_handling	code_includes_gradient_clipping	code_includes_numerical_safeguards	code_languages	code_production_ready	code_repository	code_tested	cognitive_approach	cognitive_complexity	cognitive_load	collaboration_areas	collaboration_platforms	collaboration_type	collection	commercial_use	commercial_use_allowed	community_discussion_enabled	completeness_score	completion_time_seconds	compliance_standards	computational_approach	computational_complexity	computational_complexity_analysis	computational_complexity_classes	computational_ecosystem	computational_ecosystem_requirements	computational_environment	computational_performance	computational_reproducibility_score	computational_requirements	conceptual_threads	conference_presentation	conference_track	consciousness_exploration	consciousness_level	consciousness_resonance	consciousness_state	contains_code	contains_diagrams	contains_eigenvalue_bounds	contains_fisher_information	contains_formal_definitions	contains_gradient_derivations	contains_hessian_analysis	contains_interactive_elements	contains_lipschitz_constants	contains_lyapunov_functions	contains_mathematics	content_features	content_language	content_rating	content_rating_reason	content_warnings	contributors	cover_image_generated	cross_synthesis_with	cultural_reference	data_analysis_tools	data_repository	datasets_used	date	deprecations	derivative_works	derivative_works_allowed	description	detail_level	difficulty_level	dns_prefetch	document_type	doi	domain	domain_tags	educational_level	educational_themes	emotional_arc	emotional_resonance	engagement_type	equations_count	estimated_citations	estimated_complexity	estimated_discussion_value	estimated_reading_time	estimated_shares	estimated_word_count	ethical_considerations	ethical_review_status	evolution_stage	excerpt	expected_citation_count	external_references	external_systems	faq_schema	featured_image	figures_count	fixed_parameters	format	format_style	format_style_tags	format_tags	format_type	fractal_depth	funding_sources	funding_stage	future_work_directions	generation_method	genre	geo_placename	geo_position	geo_region	geographic_setting	googlebot	has_alt_text	has_appendices	has_captions	has_code	has_diagrams	has_inspired	has_interactive_elements	has_mathematics	has_simulations	has_transcripts	historical_event	historical_period	how_to_schema	hreflang	human_contribution	human_contribution_percentage	impact_audience	impact_audience_tags	impact_tags	implementation_languages	implementation_paradigm	implementation_stage	implementation_status	includes_higher_order_analysis	includes_implementations	includes_lipschitz_analysis	includes_numerical_stability	includes_stability_analysis	innovation_level	input_shape	inspired_by	integrations	intellectual_complexity	intended_medium	interdisciplinary	interdisciplinary_connections	interdisciplinary_domains	interdisciplinary_focus	interdisciplinary_innovation_score	interdisciplinary_tags	is_cornerstone	is_experimental	is_featured	is_gateway	is_generative	is_humor	is_pioneering	is_self_modifying	is_synthesis	key_definitions	key_features	key_theorems	keywords	last_modified	last_significant_update	last_thought_date	last_thought_time	layer_name	layout	learnable_parameters	license	main_characters	maintenance_status	mathematical_domains	mathematical_frameworks	max_alternatives	max_depth	memory_bandwidth	meta_description	meta_intent	meta_keywords	meta_title	metaphorical_core	methodological_approach	methodological_tags	methodology	methodology_tags	ml_frameworks	narrative_arc	narrative_format	narrative_perspective	narrative_structure	narrative_style	narrative_themes	narrative_voice	next_review_date	og_description	og_image	og_locale	og_site_name	og_title	og_type	og_url	open_access	open_for_collaboration	open_questions	output_shape	pacing	page_count	pages_count	panel_count	panels_count	panels_per_page	parent_category	parent_document	paths_explored	peer_review_status	peer_reviewers	performance_requirements	philosophical_framework	philosophical_positions	planned_enhancements	planned_extensions	point_of_view	potential_commercial_applications	potential_impact_areas	potential_patent_areas	potential_research_collaborations	practical_applicability	prefetch_resources	preload_resources	prerequisites	preservation_status	primary_audience	primary_characters	primary_settings	primary_tags	primary_theme	primary_topic_tags	primary_topics	priority	project_scope	project_status	project_timeline	project_type	proof_confidence	proof_steps	proof_techniques	protagonist	protagonist_arc	publication_metadata	publication_stage	quantum_superposition	rating_count	rating_value	reader_participation	reading_complexity	reading_order	reading_paths	reading_prerequisites	reading_sequence	reading_time_minutes	recommended_background	recommended_citation	references_count	related_documents	related_fields	related_frameworks	related_papers	reproducibility_checklist	reproducibility_score	research_areas	research_domain	research_domains	research_funding_potential	research_impact_metrics	research_method	research_methodology	research_novelty_score	research_stage	research_stage_tags	research_subdomains	research_tags	research_transparency_score	research_validation_methods	resolution_type	responds_to_attention	review_round	review_schema	reviewers_count	revision_passes	revisions	robots	sample_size	scene_images_generated	schema_author	schema_author_type	schema_contribution_type	schema_date_modified	schema_date_published	schema_discipline	schema_headline	schema_image	schema_inlanguage	schema_inLanguage	schema_publisher	schema_reading_time	schema_research_method	schema_research_type	schema_type	schema_version	schema_word_count	search_exclude	secondary_audience	secondary_themes	sections	security_requirements	self_modifying	seo_keywords	setting	setting_reference_images	sitemap_exclude	social_media_potential	societal_impact_potential	space_complexity	status	story_structure	story_type	subcategory	submission_status	supplementary_materials	symbolic_elements	system_components	system_properties	tags	target_audience	target_users	team_size	technical_depth	technical_domain	technical_domain_tags	technical_domains	technical_tags	technologies	technology_readiness_level	temporal_awareness	temporal_context	temporal_scope	temporal_tags	tertiary_audience	themes	theoretical_foundation	thinking_domain	thinking_style	thought_generation	thought_iteration	thought_maturity	time_complexity_backward	time_complexity_forward	time_period	title	tone	topics	total_panels	total_scenes	total_word_count	tracks_reader_journey	update_frequency	url	use_cases	validation_status	version	version_date	version_history	version_tracking	visual_medium	visual_style	visual_techniques	visualization_tools	work_type	worlds
_posts/social/2025-12-01-psychosocial-assistant.md																								[]																			index,follow	true			https://fractalthoughtengine.com/projects/psychosocial-engine	projects				weekly					[]													moderate																									collaborative															en	general										"2025-12-01T00:00:00.000Z"				A comprehensive project proposal for an AI-powered psychosocial assistant that bridges emotional regulation and executive function through biometric feedback, gamified neurotechnology, and compassionate logic.		intermediate	["https://fonts.googleapis.com"]	project								analytical											The Psychosocial Engine is a superset of a personal agent and support companion that bridges internal emotional states with external execution. Unlike current AI assistants that assume rationality or therapy bots that cannot help users execute tasks, this hybrid system manages anxiety while enabling productivity through biometric monitoring and neurologically-informed gamification.				true	../../assets/images/psasst/orbit_sync_ui_mockup.png																Global		index,follow													true	[{"lang":"en"}]																											false		true	true					true				["psychosocial engine","executive function","emotional regulation","biometric feedback","AI assistant","mental health technology","nervous system regulation","EMDR","affective computing","harm reduction"]	"2025-12-01T00:00:00.000Z"		"2025-12-01T00:00:00.000Z"			post										Explore a hybrid AI architecture combining emotional regulation, executive function support, and biometric feedback for compassionate productivity enhancement.		psychosocial engine, AI assistant, emotional regulation, executive function, biometric feedback, mental health technology, harm reduction	The Psychosocial Engine: AI-Powered Executive Function & Emotional Regulation															A revolutionary hybrid architecture for AI-assisted emotional regulation and executive function, powered by biometric feedback and gamified neurotechnology.	../../assets/images/psasst/orbit_sync_ui_mockup.png	en_US	Fractal Thought Engine	The Psychosocial Engine: Bridging Emotion & Execution	article																												["/assets/images/biometric-interview-analysis-ui.png","/assets/images/technical-roadmap-layers.png"]	["/assets/images/psychosocial-engine-concept-diagram.png","/assets/images/three-pillars-architecture-flow.png"]										0.8															active						12				["path/to/cognitive-architecture-framework.md","path/to/human-ai-collaboration-models.md","path/to/biometric-sensing-ethics.md"]																							false				index,follow			Fractal Thought Engine			"2025-12-01T00:00:00.000Z"	"2025-12-01T00:00:00.000Z"		The Psychosocial Engine: A Hybrid Architecture for Executive Function & Emotional Regulation	../../assets/images/psasst/orbit_sync_ui_mockup.png			Fractal Thought Engine	PT12M			TechArticle		2400	false									false				working			AI-Assisted Mental Health & Productivity						["AI-Consciousness","Human-AI-Collaboration","Cognitive-Architecture","Phenomenology","Machine-Learning","Ethics-Technology","Healthcare","Psychology","Neurotechnology","Harm-Reduction"]																			analytical	1						The Psychosocial Engine: A Hybrid Architecture for Executive Function & Emotional Regulation								https://fractalthoughtengine.com/projects/psychosocial-engine												
_posts/social/2025-11-20-revolutionary-consciousness-platform.md																								[]																			index,follow	true			https://fractalthoughtengine.com/posts/revolutionary-consciousness-platform	social				monthly					[]													intense																									meta															en	general										"2025-11-20T00:00:00.000Z"				A comprehensive position paper proposing systematic transformation of political, economic, educational, and technological systems to prioritize human consciousness development and liberation.		intermediate	[]	position_paper								analytical											This manifesto outlines revolutionary restructuring across healthcare, education, economics, politics, technology, and environment, arguing that consciousness evolution and political revolution are inseparable processes.				false	../../assets/images/consciousness_suppression_liberation_spectrum.png																Global		index,follow													false	[]																											false		false	true					true				["consciousness","political revolution","social systems","economic restructuring","education reform","technology democratization"]	"2024-01-01T00:00:00.000Z"		"2024-01-01T00:00:00.000Z"			post										Position paper proposing revolutionary restructuring of political, economic, and technological systems to prioritize human consciousness development and liberation.		consciousness, political revolution, social systems, economic reform, technology democratization, education restructuring	The Consciousness Revolution: Systematic Platform for Social Transformation															Comprehensive manifesto proposing revolutionary transformation of social, economic, political, and technological systems.	../../assets/images/consciousness_suppression_liberation_spectrum.png	en_US	Fractal Thought Engine	The Consciousness Revolution: A Platform for Systematic Change	article																												[]	[]										0.7															active						12				[]																							false				index,follow			Andrew			"2024-01-01T00:00:00.000Z"	"2024-01-01T00:00:00.000Z"		The Consciousness Revolution: A Platform for Systematic Change	../../assets/images/consciousness_suppression_liberation_spectrum.png			Fractal Thought Engine	PT12M			ScholarlyArticle		3200	false									false				working			Political Philosophy and Social Systems						["Social-Systems","Philosophy-of-Mind","Position-Paper","Political-Theory","Consciousness-Studies","Economic-Systems","Educational-Reform","Technological-Liberation"]																			analytical	1						The Consciousness Revolution: A Platform for Systematic Change																				
_posts/social/2025-08-08-technofeudalism-gunpowder-essay.md																																																social				monthly																		moderate																									meta															en	general										"2025-08-08T00:00:00.000Z"				Historical analysis comparing AI's disruption of Big Tech platforms to how gunpowder ended feudalism, revealing AI as both economic disruptor and population management tool.		intermediate		synthesis								analytical											The dominant narrative about AI cementing Big Tech's power is backwards. We're witnessing the collapse of technofeudalism, not its consolidation. Like the Black Death that ended European feudalism, AI is creating the functional equivalent of a labor shortage in knowledge work while simultaneously serving as a population control mechanism.																																																																true		true	true					true				["technofeudalism","platform economy","AI disruption","big tech","economic transition","feudalism","black death","demographic shock","population control","DeepSeek","gunpowder revolution"]	"2025-01-27T14:30:00.000Z"		"2025-01-27T00:00:00.000Z"			post										Historical analysis reveals AI isn't strengthening Big Tech but destroying platform dominance, just as gunpowder ended feudalism. Explores demographic and economic parallels.		technofeudalism, AI disruption, platform economy, big tech monopoly, historical analysis, economic transition, DeepSeek, digital transformation	The End of Technofeudalism: AI as Digital Gunpowder Against Platform Monopolies																																																											0.8															active		1				25				[]																											index,follow			Fractal Thought Engine			"2025-01-27T00:00:00.000Z"	"2025-01-27T00:00:00.000Z"		The End of Technofeudalism: Why AI is the Gunpowder That's Destroying Digital Castles				Fractal Thought Engine	PT25M			Article		4800														stable			Economic Systems Analysis						["AI-Consciousness","Social-Systems","Historical-Analysis","Economics","Game-Theory","Human-AI-Collaboration","Public-Policy"]																			analytical	1						The End of Technofeudalism: Why AI is the Gunpowder That's Destroying Digital Castles																				
_posts/social/2025-08-08-secret-plans-rich-classes.md																														["Public-Policy","Social-Justice","Economics"]																		social				monthly																		intense																									meta															en	mature										"2025-08-08T00:00:00.000Z"				A comprehensive analysis of elite demographic management strategies in the age of AI automation, examining coordination problems, resistance dynamics, and alternative futures.		advanced		research_paper								analytical											An in-depth examination of how global elites are navigating the transition to automated economies through population management and technological control, including analysis of implementation challenges and resistance strategies.											["Research-Paper","Commentary"]										Global																					["Academic-Research","Public-Policy","Popular-Science"]																					["Complexity-Science","Systems-Science","Ethics-Technology"]	true		true	false					true				["elite coordination","automation strategy","population control","AI governance","technological inequality","social engineering","power consolidation","resistance tactics"]	"2024-01-15T14:30:00.000Z"		"2024-01-15T00:00:00.000Z"			post										Comprehensive analysis of elite demographic management strategies, AI automation implementation, and the complex dynamics of power, resistance, and technological control in modern society.		elite strategy, AI automation, population management, technological control, social systems, power dynamics, resistance analysis	Elite Strategy Analysis: Automation, Demographics, and Power in the AI Age			["Theoretical-Framework","Cross-Synthesis","Case-Study"]												A detailed analysis of elite strategy in the age of artificial intelligence, examining automation, population management, and the collision with reality.		en_US		On the Secret Plans and Motives of the Rich Classes	article																																			["Social-Systems","AI-Consciousness","Game-Theory","Philosophy-of-Mind"]				0.8															active		1				180				[]															["Meta-Analysis","Position-Paper"]												index,follow			Fractal Thought Engine			"2024-01-15T00:00:00.000Z"	"2024-01-15T00:00:00.000Z"		Elite Strategy Analysis in the Age of AI Automation				Fractal Thought Engine	PT180M			ScholarlyArticle		25000														stable			Elite Strategy Analysis						["elite-strategy","ai-automation","population-management","power-dynamics","social-systems","technological-control","demographic-pressure","resistance-analysis"]								["Machine-Learning","Information-Theory","Distributed-Systems"]						["Current-Research","Future-Projections"]					analytical	1						On the Secret Plans and Motives of the Rich Classes of Today's World																				
_posts/social/2025-08-08-religion-utility-analysis-framework.md																																																social				monthly																		intense																									meta																										"2025-08-08T00:00:00.000Z"				A comprehensive probabilistic framework for rigorously analyzing the impact of religious institutions on human development across multiple dimensions		advanced		framework								analytical											This framework treats religious institutions as complex systems whose effects on human development can be measured probabilistically across scientific development, human rights, violence organization, and economic development dimensions.																																																																true		true	false					true				["religious institutions","probabilistic modeling","human development","institutional analysis","utility framework","causal inference","social systems","comparative analysis"]	"2024-01-15T10:30:00.000Z"		"2024-01-15T00:00:00.000Z"			post										Comprehensive framework for measuring religious institutional impact on human development using probabilistic models, causal classification, and comparative analysis across multiple dimensions.		religious institutions, probabilistic modeling, institutional analysis, human development, utility framework, social systems analysis	Rigorous Religion Utility Analysis Framework - Probabilistic Institutional Impact Model															A probabilistic model for assessing institutional religious impact on human development with rigorous methodology and comparative analysis.				Rigorous Culture/Religion Utility Analysis Framework	article																																							0.8															active		1				25				[]																											index,follow			Fractal Thought Engine			"2024-01-15T00:00:00.000Z"	"2024-01-15T00:00:00.000Z"		Rigorous Culture/Religion Utility Analysis Framework					PT25M			ScholarlyArticle		2800														stable			Institutional Analysis						["Social-Systems","Theoretical-Framework","Mathematical-Modeling","Probability-Theory","Public-Policy","Ethics-Technology","Computational-Analysis","Research-Paper"]																			analytical	1						Rigorous Culture/Religion Utility Analysis Framework																				
_posts/social/2025-08-08-american-christianity-critique-2025.md																																												true				social				monthly																		intense																									meta															en	mature										"2025-08-08T00:00:00.000Z"				A comprehensive critical analysis of American Christianity in 2025, examining institutional hypocrisy, political capture, and the systematic abandonment of core Christian teachings.		intermediate		research_paper								analytical											American Christianity in 2025 represents perhaps the most striking example of institutional religious hypocrisy in modern history. This analysis examines how a faith founded on radical love has become a vehicle for policies that explicitly reject its foundational principles.				false																	US																																											false		true	false					true				["american christianity","religious hypocrisy","christian nationalism","lifewise academy","institutional capture","political theology","child manipulation","religious fraud"]	"2027-01-27T10:00:00.000Z"		"2025-01-27T00:00:00.000Z"			post										Comprehensive analysis of how American Christianity has abandoned its core teachings for political power, examining data on Christian nationalism, institutional capture, and child manipulation programs.		american christianity, christian nationalism, religious hypocrisy, lifewise academy, institutional critique, political theology	American Christianity 2025: Critical Analysis of Religious Institutional Failure															A data-driven analysis of how American Christianity has become the primary vehicle for policies that contradict its foundational teachings.		en_US		American Christianity in 2025: The Great Apostasy in Plain Sight	article																																							0.8															contemplative		1				25				[]																							false				index,follow			Fractal Thought Engine			"2025-01-27T00:00:00.000Z"	"2025-01-27T00:00:00.000Z"		American Christianity in 2025: A Critical Assessment				Fractal Thought Engine	PT25M			Article		3200	false									false				stable			Religious Institutional Analysis						["Social-Systems","Religious-Institutions","Political-Theology","Institutional-Critique","American-Christianity","Social-Justice","Child-Welfare","Moral-Philosophy"]																			analytical	1						American Christianity in 2025: A Critical Assessment																				
