_posts/projects/2025-08-08-flood-memory-model.md																														["Anthropology","Cultural-Studies","Environmental-Science","Historical-Analysis"]																		projects				monthly																		intense																									analytical																										"2025-08-08T00:00:00.000Z"				Agent-based computational model simulating the emergence, propagation, and evolution of flood myths as cultural memories of Pleistocene environmental catastrophes		advanced		research_paper								analytical											This research presents a comprehensive agent-based model tracking how traumatic environmental memories of late Pleistocene floods spread through populations, adapt to local conditions, and become institutionalized through written codification across four distinct historical phases.																																																																false		true	false					true				["flood myths","cultural transmission","agent-based model","environmental catastrophe","oral tradition","cultural memory","narrative evolution","institutional codification"]	"2024-01-15T14:30:00.000Z"		"2024-01-15T00:00:00.000Z"			post										Comprehensive agent-based model simulating flood myth evolution from Pleistocene environmental trauma through institutional codification, exploring cultural transmission dynamics.		agent-based modeling, cultural evolution, flood myths, environmental memory, computational anthropology, narrative transmission, cultural dynamics	Agent-Based Model: Cultural Memory Dynamics of Flood Myths - Computational Anthropology Research			["Agent-Based-Modeling","Theoretical-Framework","Mathematical-Modeling","Computational-Analysis"]												Computational model exploring how environmental catastrophe memories evolve into cultural myths across millennia		en_US		Agent-Based Model: Cultural Memory Dynamics of Flood Myths	article																																			["Computational-Analysis","Mathematical-Modeling","Cultural-Evolution","Environmental-History"]				0.8															active		3				25				["../portfolio/2025-06-30-convolution-paper.md","./2025-08-08-spiral-number-system.md","../portfolio/2025-07-01-trust-regions.md"]																											index,follow			Fractal Thought Engine			"2024-01-15T00:00:00.000Z"	"2024-01-15T00:00:00.000Z"		Agent-Based Model: Cultural Memory Dynamics of Flood Myths				Fractal Thought Engine	PT25M			ScholarlyArticle		3200														working			Cultural Evolution Modeling						["Cultural-Evolution","Agent-Based-Modeling","Flood-Myths","Cultural-Memory","Environmental-History","Oral-Tradition","Institutional-Codification","Computational-Anthropology"]								["Complex-Systems","Network-Analysis","Simulation-Modeling"]											mathematical	2						Agent-Based Model: Cultural Memory Dynamics of Flood Myths																				
_posts/projects/2025-08-08-entropy-ant-computation.md																											["AI-Research","Neurobiological-Research"]																					projects																						intense																									emergent															en	general										"2025-08-08T00:00:00.000Z"				A novel neurobiological emulation system using live ants as computational agents within a 3D sphere-packing lattice, where entropy gradients create dynamic gravitational fields.		advanced		research_paper								analytical											Explores a revolutionary computational architecture that uses live ants as processing elements in a 3D lattice structure, guided by entropy gradients to maintain optimal chaos for complex computation. Bridges biology, physics, and computer science through swarm-based neurobiological emulation.																																																										true						false		true	false					true				["entropy","ant swarm","3D computation","cellular automata","biological computing","chaos theory","neural networks"]	"2025-08-08T00:00:00.000Z"		"2024-01-15T00:00:00.000Z"			post										Revolutionary computational system using live ants in 3D lattice guided by entropy gradients. Novel approach bridging biology, physics, and computer science for neurobiological emulation.		ant swarm computation, entropy-driven computing, 3D biological architecture, neurobiological emulation, chaos computation	3D Entropy-Driven Ant Swarm Computation Architecture - Novel Biological Computing															Revolutionary biological computing system using live ants guided by entropy gradients in 3D space		en_US		3D Entropy-Driven Ant Swarm Computation Architecture	article																																																						active		1				15				[]														proof-of-concept													index,follow			Fractal Thought Engine			"2024-01-15T00:00:00.000Z"	"2024-01-15T00:00:00.000Z"		3D Entropy-Driven Ant Swarm Computation Architecture					PT15M			ScholarlyArticle		1200														working			Computational Architecture						["AI-Consciousness","Cognitive-Architecture","Machine-Learning","Computational-Biology","Complexity-Science","Swarm-Intelligence","Neurobiological-Emulation"]					["Neural-Networks","Computational-Biology","Complexity-Science"]														experimental	1						3D Entropy-Driven Ant Swarm Computation Architecture																				
_posts/projects/2025-08-08-enhanced-ceprle-math.md																																																projects				monthly																		intense																									analytical															en	general										"2025-08-08T00:00:00.000Z"				Advanced mathematical framework for multi-orientation scanning and wavelet-based geometric analysis in enhanced CEP-RLE compression		advanced		framework								analytical											Comprehensive mathematical treatment of enhanced CEP-RLE featuring multi-orientation ensemble scanning, island run topology evolution, and wavelet analysis for geometric profile characterization.																																																																true		false	false					true				["CEP-RLE","wavelet analysis","geometric reconstruction","multi-orientation scanning","spatial compression","run-length encoding","topology","mathematical framework"]	"2024-01-15T14:30:00.000Z"		"2024-01-15T00:00:00.000Z"			post										Advanced mathematical framework for spatial data compression using multi-orientation scanning, wavelet transforms, and geometric topology analysis in enhanced CEP-RLE systems.		CEP-RLE, wavelet analysis, multi-orientation scanning, geometric reconstruction, spatial compression, mathematical framework	Enhanced CEP-RLE Mathematical Framework - Multi-Orientation Wavelet Analysis																																																											0.8															active		3				25				["./2025-06-30-knots.md","../consciousness/2025-07-06-meta-content.md"]																											index,follow			Fractal Thought Engine			"2024-01-15T00:00:00.000Z"	"2024-01-15T00:00:00.000Z"		Enhanced CEP-RLE: Multi-Orientation Scanning and Wavelet-Based Geometric Analysis				Fractal Thought Engine	PT25M			TechArticle		2800														stable			Mathematical Frameworks						["Mathematical-Modeling","Computational-Analysis","Information-Theory","Computer-Vision","Optimization","Machine-Learning"]																			mathematical	1						Enhanced CEP-RLE: Multi-Orientation Scanning and Wavelet-Based Geometric Analysis																				
_posts/projects/2025-08-08-discrete-quantum-spacetime-paper.md																																																projects				monthly																		intense																									analytical															en	general										"2025-08-08T00:00:00.000Z"				A novel framework for understanding quantum information and spacetime structure through braid group equivalence classes and discrete causal networks.		research		research_paper								analytical											We present a framework where discrete quantum spacetime emerges from equivalence classes of braid groups under semi-unitary transformations, revealing massive quantum vacuum degeneracy and natural spacetime dimensionality.																																																																true		true	false					true				["quantum spacetime","braid groups","causal set theory","quantum information","noncommutative geometry","discrete spacetime","quantum gravity","topological quantum computing"]	"2024-01-15T10:00:00.000Z"		"2024-01-15T00:00:00.000Z"			post										Revolutionary approach to quantum gravity using braid group theory and causal set networks. Discover how spacetime emerges from discrete quantum information structures.		quantum spacetime, braid groups, causal set theory, quantum gravity, discrete spacetime, topological quantum computing	Discrete Quantum Spacetime from Braid Groups - Quantum Information Theory															Groundbreaking research on how spacetime structure emerges from quantum information networks using braid group mathematics.		en_US		Discrete Quantum Spacetime: A Braid Group Approach	article																																							0.9															passive		1				25																															index,follow			Fractal Thought Engine			"2024-01-15T00:00:00.000Z"	"2024-01-15T00:00:00.000Z"		Discrete Quantum Spacetime from Braid Group Equivalence Classes				Fractal Thought Engine	PT25M			ScholarlyArticle		2800														stable			Quantum Physics						["Quantum-Computing","Quantum-Physics","Mathematical-Modeling","Theoretical-Framework","Information-Theory","Topology","AI-Consciousness","Computational-Analysis"]																			mathematical	1						Discrete Quantum Spacetime from Braid Group Equivalence Classes: A Causal Set Theory Approach																				
_posts/projects/2025-08-08-cst-multiverse-physics.md																																												true			https://fractalthoughtengine.com/projects/cst-multiverse-physics	projects				monthly					[]													transcendent																									emergent																										"2025-08-08T00:00:00.000Z"				A framework for generating interactive narrative multiverses using Causal Set Theory, where documents become spacetime events and reader choices determine causal relationships.		research		research_paper								analytical											We present a revolutionary approach to interactive storytelling by treating narratives as discrete spacetime manifolds governed by causal set theory. Documents become events in narrative spacetime, reader choices create causal links, and the emergent structure forms coherent multiverse experiences with genuine relativistic properties.				false																																false																												true		true	false					true				["causal set theory","narrative spacetime","interactive storytelling","agent-based generation","multiverse","knowledge graph","relativistic narratives","computational creativity"]	"2024-01-15T14:30:00.000Z"		"2024-01-15T00:00:00.000Z"			post										Revolutionary framework combining causal set theory with AI agents to generate dynamic, physics-based interactive narratives and multiverse storytelling experiences.		causal set theory, interactive narratives, multiverse generation, computational physics, AI storytelling, spacetime narratives	Causal Set Theory for Interactive Narrative Multiverse Generation | Physics-Based Storytelling															Groundbreaking research applying relativistic physics to create dynamic, causally-consistent narrative multiverses through reader interaction.		en_US	Fractal Thought Engine	Physics-Based Interactive Storytelling: Causal Set Theory Meets AI	article																																							0.9															active		1				25				[]																							false				index,follow			Fractal Thought Engine			"2024-01-15T00:00:00.000Z"	"2024-01-15T00:00:00.000Z"		Causal Set Theory for Agent-Based Multiverse Knowledge Graph Generation	/assets/images/cst_multiverse_schema.png			Fractal Thought Engine	PT25M			ScholarlyArticle		2800														working			Computational Physics						["Causal-Set-Theory","AI-Consciousness","Computational-Analysis","Theoretical-Framework","Machine-Learning","Quantum-Computing","Information-Theory","Interactive-Storytelling","Complex-Systems","Mathematical-Modeling"]																			mathematical	1						Causal Set Theory for Agent-Based Multiverse Knowledge Graph Generation																				
_posts/projects/2025-08-08-ceprle-rust-implementation.md																																																projects																						intense																									collaborative																										"2025-08-08T00:00:00.000Z"				Complete Rust implementation specification for Continuous Expectation-Prior Run-Length Encoding with analysis-ready geometric feature extraction		advanced		technical_proposal								analytical											Detailed technical specification for implementing CEP-RLE in Rust, including continuous run detection, expectation-prior mechanisms, geometric analysis, and spatial indexing for direct analysis from compressed data.																																																																true												["CEP-RLE","continuous encoding","run-length encoding","sub-pixel precision","geometric features","spatial analysis"]	"2024-01-15T14:30:00.000Z"		"2024-01-15T00:00:00.000Z"			post										Technical specification for Rust implementation of Continuous Expectation-Prior Run-Length Encoding with sub-pixel precision and integrated geometric feature extraction capabilities.		CEP-RLE, Rust implementation, compression algorithm, geometric analysis, computer vision, spatial indexing	CEP-RLE Rust Implementation - Advanced Compression with Geometric Analysis																																																																										active		1				45																																		Fractal Thought Engine			"2024-01-15T00:00:00.000Z"	"2024-01-15T00:00:00.000Z"		CEP-RLE Rust Implementation Specification					PT45M			TechArticle		8500														working			Compression Algorithms						["compression","rust","computer-vision","geometric-analysis","spatial-indexing"]																			analytical	1						CEP-RLE Rust Implementation Specification																				
_posts/projects/2025-08-08-bitcoin-origin-probability-analysis.md																																												true				projects				monthly																		intense																									analytical															en	general										"2025-08-08T00:00:00.000Z"				Comprehensive Bayesian probability analysis examining the likelihood of different Bitcoin creation theories, with particular focus on North Korean state involvement versus individual Western creators.		advanced		research_paper								analytical											A systematic probability analysis of Bitcoin's origins using Bayesian reasoning to evaluate evidence for North Korean state creation versus alternative theories including Nick Szabo, Hal Finney, and academic teams.				false																	Global															false																												false		true	false					true				["bitcoin origin","satoshi nakamoto","north korea","bayesian probability","cryptocurrency creation","state actor","financial warfare"]	"2024-12-19T10:30:00.000Z"		"2024-12-19T00:00:00.000Z"			post										Detailed probability analysis of Bitcoin creation theories using Bayesian methods. Examines North Korean state involvement, individual creators like Nick Szabo and Hal Finney, and academic teams with evidence-based probability estimates.		bitcoin origin, satoshi nakamoto identity, north korea bitcoin, cryptocurrency analysis, bayesian probability, financial warfare, state actors	Bitcoin Origin Analysis: North Korea vs Satoshi Nakamoto Theories - Bayesian Probability Study															Systematic analysis reveals North Korean state creation as most probable Bitcoin origin theory at 45% likelihood, challenging conventional wisdom about individual creators.		en_US		Bitcoin Origin Probability Analysis: Who Really Created Bitcoin?	article																																							0.8															active		1				25				[]																							false				index,follow			Fractal Thought Engine			"2024-12-19T00:00:00.000Z"	"2024-12-19T00:00:00.000Z"		Bitcoin Origin Probability Analysis: North Korea vs Alternative Theories				Fractal Thought Engine	PT25M			ScholarlyArticle		2800	false									false				stable			Cryptocurrency Analysis						["Bitcoin","North-Korea","Cryptocurrency","Bayesian-Analysis","Probability-Theory","Cybersecurity","State-Actors","Financial-Systems"]																			analytical	1						Bitcoin Origin Probability Analysis: North Korea vs Alternative Theories																				
_posts/projects/2025-08-08-bifurcation-cascade-paper.md																														["Economics","Climate-Science","Social-Systems"]																		projects				monthly					[]													intense																									analytical																										"2025-08-08T00:00:00.000Z"				A mathematical analysis of bifurcation cascades across complex systems, exploring universal patterns in critical transitions from technological disruption to ecological tipping points.		advanced		research_paper								analytical											This research paper investigates how destabilizing events trigger reorganization waves across diverse complex systems, proposing that Feigenbaum universality principles apply to social, technological, and natural systems approaching critical transitions.											["Research-Paper"]																															["Academic-Research","Technical-Documentation"]																					["Complexity-Science","Systems-Science","Cognitive-Science"]	true		true	false					true				["bifurcation cascades","Feigenbaum universality","critical slowing down","complex systems","phase transitions","reorganization waves","system dynamics","chaos theory"]	"2024-01-15T14:30:00.000Z"		"2024-01-15T00:00:00.000Z"			post										Mathematical analysis of bifurcation cascades across complex systems, exploring universal patterns in critical transitions and reorganization waves in social, technological, and ecological domains.		bifurcation theory, complex systems, critical transitions, chaos theory, Feigenbaum constants, mathematical modeling, system dynamics	Bifurcation Cascades in Complex Systems - Mathematical Analysis of Critical Transitions			["Mathematical-Modeling","Theoretical-Framework","Literature-Review"]												Cross-domain analysis of critical transitions using mathematical frameworks from chaos theory and complex systems science.		en_US	Fractal Thought Engine	Bifurcation Cascades and Reorganization Waves in Complex Systems	article																																			["Mathematical-Modeling","Theoretical-Framework","Cross-Synthesis"]				0.8															active		1				25				[]															["Full-Implementation","Validation-Study"]												index,follow			Fractal Thought Engine			"2024-01-15T00:00:00.000Z"	"2024-01-15T00:00:00.000Z"		Bifurcation Cascades and Reorganization Waves in Complex Systems				Fractal Thought Engine	PT25M			ScholarlyArticle		3500														stable			Complex Systems Analysis						["bifurcation-theory","complex-systems","critical-transitions","feigenbaum-constants","reorganization-dynamics","phase-transitions","chaos-theory","network-topology","mathematical-modeling"]								["Information-Theory","Probability-Theory","Topology"]						["Current-Research","Future-Projections"]					mathematical	1						Bifurcation Cascades and Reorganization Waves in Complex Systems: A Cross-Domain Analysis of Critical Transitions																				
_posts/projects/2025-08-08-autonoma-research-paper.md																																												true				projects				monthly																		intense																									collaborative																										"2025-08-08T00:00:00.000Z"				A novel computational architecture combining multi-agent systems and cellular automata to model neural development and create self-organizing computational networks.		research	["https://cdn.mathjax.org","https://fonts.googleapis.com"]	research_paper								analytical											Binary Coded Layered Autonoma (BCLA) introduces a biologically-inspired computational model where autonomous agents representing growth cones establish pathways for electrical activity propagation, creating emergent neural-like networks with multi-timescale dynamics.				false																																false																												true		true	false					true				["cellular automata","neural membrane dynamics","multi-agent systems","self-organization","distributed computing","phenomenological modeling","bio-inspired computation","growth cones","synaptic pathways","temporal hierarchy"]	"2025-01-27T14:30:00.000Z"		"2025-01-27T00:00:00.000Z"			post										Discover Binary Coded Layered Autonoma, a breakthrough computational architecture modeling neural development through multi-agent cellular automata systems with emergent wave phenomena.		cellular automata, neural networks, bio-inspired computing, self-organization, computational neuroscience, multi-agent systems, phenomenological modeling	BCLA: Neural-Inspired Self-Organizing Computational Networks | Fractal Thought Engine															Revolutionary computational model combining growth cone agents and cellular automata to create self-assembling neural networks with biological temporal dynamics.		en_US	Fractal Thought Engine	Binary Coded Layered Autonoma: Neural-Inspired Computing Architecture	article																												["/assets/images/bcla_diagrams.jpg","/related/neural-computing.html"]	["/assets/css/research-paper.css","/assets/js/math-renderer.js"]										0.9															active		1				45				["./2025-08-08-flood-memory-model.md","./2025-08-08-autonoma-research-paper.md","../social/2025-07-03-hiring.md"]																							false				index,follow			Fractal Thought Engine Research Team			"2025-01-27T00:00:00.000Z"	"2025-01-27T00:00:00.000Z"		Binary Coded Layered Autonoma: A Phenomenological Model of Neural Membrane Dynamics				Fractal Thought Engine	PT45M			ScholarlyArticle		12500														stable			Computational Neuroscience						["AI-Consciousness","Cognitive-Architecture","Machine-Learning","Neural-Networks","Computational-Analysis","Mathematical-Modeling","Research-Paper","Current-Research","Academic-Research","Theoretical-Framework"]																			mathematical	1						Binary Coded Layered Autonoma: A Phenomenological Model of Neural Membrane Dynamics and Self-Assembling Computational Networks																				
_posts/projects/2025-08-08-agent-orchestration-language.md																																																projects				monthly																		intense																									collaborative																										"2025-08-08T00:00:00.000Z"				A technical framework for type-safe agent orchestration with compositional contracts and resource-aware planning		advanced		framework								analytical											Current agent planning systems underutilize agent capabilities by forcing them into rigid operational boxes. This language addresses the orchestration bottleneck by providing a type-safe, compositional framework that captures agent flexibility while maintaining compile-time guarantees.																																																																true		true	false					true				["agent orchestration","type system","compositional programming","multi-agent systems","resource constraints"]	"2024-01-15T10:00:00.000Z"		"2024-01-15T00:00:00.000Z"			post										Technical specification for a compositional agent orchestration language with type-safe contracts, resource constraints, and compile-time planning optimization.		agent orchestration, multi-agent systems, type safety, compositional programming, resource planning	Agent Orchestration Language: Type-Safe Multi-Agent System Framework																																																											0.8															active		1				25																															index,follow			Fractal Thought Engine			"2024-01-15T00:00:00.000Z"	"2024-01-15T00:00:00.000Z"		Agent Orchestration Language: Technical Overview				Fractal Thought Engine	PT25M			TechArticle		2800														working			Agent Systems						["AI-Consciousness","Machine-Learning","Computational-Analysis","Technical-Framework","Agent-Systems"]																			analytical	1						Agent Orchestration Language: Technical Overview																				
_posts/projects/2025-07-11-agentic-cms-spec.md																																																projects																						intense																									meta																										"2025-07-11T00:00:00.000Z"				Technical specification for an autonomous research evolution platform that treats research artifacts as living, evolving entities		advanced		framework								analytical											AREP is an agentic content management system designed to autonomously recombine, improve, research, and evolve research artifacts through AI-driven exploration of combinatorial possibilities.																																																																true		true	false					true				["agentic cms","autonomous research","ai agents","research evolution","cognitive substrates","socratic reconstruction"]	"2025-07-11T12:00:00.000Z"		"2025-07-11T00:00:00.000Z"			post										Comprehensive technical specification for building an AI-powered research platform that autonomously evolves scientific knowledge through systematic artifact recombination and improvement.			AREP: Autonomous Research Evolution Platform Technical Specification																																																																										active		1				45																																		Fractal Thought Engine				"2025-07-11T00:00:00.000Z"		Autonomous Research Evolution Platform Technical Specification					PT45M			TechArticle																working			Autonomous Research Systems						["AI-Consciousness","Human-AI-Collaboration","Cognitive-Architecture","Machine-Learning","Autonomous-Systems"]																			analytical	1						Autonomous Research Evolution Platform (AREP) Specification																				
